{
  "schemaVersion": "1.0.0",
  "metamodel": "SysML",
  "modelVersionUri": "https://www.omg.org/spec/SysML/20250201",
  "entries": {
    "AcceptActionUsage": {
      "kind": "class",
      "package": "Actions",
      "qualifiedName": "SysML::Systems::Actions::AcceptActionUsage",
      "isAbstract": false,
      "summary": "An AcceptActionUsage is an ActionUsage that specifies the acceptance of an incomingTransfer from the Occurrence given by the result of its receiverArgument Expr…",
      "extends": [
        "ActionUsage"
      ],
      "file": "elements/AcceptActionUsage.md"
    },
    "ActionDefinition": {
      "kind": "class",
      "package": "Actions",
      "qualifiedName": "SysML::Systems::Actions::ActionDefinition",
      "isAbstract": false,
      "summary": "An ActionDefinition is a Definition that is also a Behavior that defines an Action performed by a system or part of a system.",
      "extends": [
        "Behavior",
        "OccurrenceDefinition"
      ],
      "file": "elements/ActionDefinition.md"
    },
    "ActionUsage": {
      "kind": "class",
      "package": "Actions",
      "qualifiedName": "SysML::Systems::Actions::ActionUsage",
      "isAbstract": false,
      "summary": "An ActionUsage is a Usage that is also a Step, and, so, is typed by a Behavior.",
      "extends": [
        "OccurrenceUsage",
        "Step"
      ],
      "file": "elements/ActionUsage.md"
    },
    "ActorMembership": {
      "kind": "class",
      "package": "Requirements",
      "qualifiedName": "SysML::Systems::Requirements::ActorMembership",
      "isAbstract": false,
      "summary": "An ActorMembership is a ParameterMembership that identifies a PartUsage as an actor parameter, which specifies a role played by an external entity in interactio…",
      "extends": [
        "ParameterMembership"
      ],
      "file": "elements/ActorMembership.md"
    },
    "AllocationDefinition": {
      "kind": "class",
      "package": "Allocations",
      "qualifiedName": "SysML::Systems::Allocations::AllocationDefinition",
      "isAbstract": false,
      "summary": "An AllocationDefinition is a ConnectionDefinition that specifies that some or all of the responsibility to realize the intent of the source is allocated to the…",
      "extends": [
        "ConnectionDefinition"
      ],
      "file": "elements/AllocationDefinition.md"
    },
    "AllocationUsage": {
      "kind": "class",
      "package": "Allocations",
      "qualifiedName": "SysML::Systems::Allocations::AllocationUsage",
      "isAbstract": false,
      "summary": "An AllocationUsage is a usage of an AllocationDefinition asserting the allocation of the source feature to the target feature.",
      "extends": [
        "ConnectionUsage"
      ],
      "file": "elements/AllocationUsage.md"
    },
    "AnalysisCaseDefinition": {
      "kind": "class",
      "package": "AnalysisCases",
      "qualifiedName": "SysML::Systems::AnalysisCases::AnalysisCaseDefinition",
      "isAbstract": false,
      "summary": "An AnalysisCaseDefinition is a CaseDefinition for the case of carrying out an analysis.",
      "extends": [
        "CaseDefinition"
      ],
      "file": "elements/AnalysisCaseDefinition.md"
    },
    "AnalysisCaseUsage": {
      "kind": "class",
      "package": "AnalysisCases",
      "qualifiedName": "SysML::Systems::AnalysisCases::AnalysisCaseUsage",
      "isAbstract": false,
      "summary": "An AnalysisCaseUsage is a Usage of an AnalysisCaseDefinition.",
      "extends": [
        "CaseUsage"
      ],
      "file": "elements/AnalysisCaseUsage.md"
    },
    "AnnotatingElement": {
      "kind": "class",
      "package": "Annotations",
      "qualifiedName": "KerML::Root::Annotations::AnnotatingElement",
      "isAbstract": false,
      "summary": "An AnnotatingElement is an Element that provides additional description of or metadata on some other Element.",
      "extends": [
        "Element"
      ],
      "file": "elements/AnnotatingElement.md"
    },
    "Annotation": {
      "kind": "class",
      "package": "Annotations",
      "qualifiedName": "KerML::Root::Annotations::Annotation",
      "isAbstract": false,
      "summary": "An Annotation is a Relationship between an AnnotatingElement and the Element that is annotated by that AnnotatingElement.",
      "extends": [
        "Relationship"
      ],
      "file": "elements/Annotation.md"
    },
    "AssertConstraintUsage": {
      "kind": "class",
      "package": "Constraints",
      "qualifiedName": "SysML::Systems::Constraints::AssertConstraintUsage",
      "isAbstract": false,
      "summary": "An AssertConstraintUsage is a ConstraintUsage that is also an Invariant and, so, is asserted to be true (by default).",
      "extends": [
        "ConstraintUsage",
        "Invariant"
      ],
      "file": "elements/AssertConstraintUsage.md"
    },
    "AssignmentActionUsage": {
      "kind": "class",
      "package": "Actions",
      "qualifiedName": "SysML::Systems::Actions::AssignmentActionUsage",
      "isAbstract": false,
      "summary": "An AssignmentActionUsage is an ActionUsage that is defined, directly or indirectly, by the ActionDefinition AssignmentAction from the Systems Model Library.",
      "extends": [
        "ActionUsage"
      ],
      "file": "elements/AssignmentActionUsage.md"
    },
    "Association": {
      "kind": "class",
      "package": "Associations",
      "qualifiedName": "KerML::Kernel::Associations::Association",
      "isAbstract": false,
      "summary": "An Association is a Relationship and a Classifier to enable classification of links between things (in the universe).",
      "extends": [
        "Classifier",
        "Relationship"
      ],
      "file": "elements/Association.md"
    },
    "AssociationStructure": {
      "kind": "class",
      "package": "Associations",
      "qualifiedName": "KerML::Kernel::Associations::AssociationStructure",
      "isAbstract": false,
      "summary": "An AssociationStructure is an Association that is also a Structure, classifying link objects that are both links and objects.",
      "extends": [
        "Association",
        "Structure"
      ],
      "file": "elements/AssociationStructure.md"
    },
    "AttributeDefinition": {
      "kind": "class",
      "package": "Attributes",
      "qualifiedName": "SysML::Systems::Attributes::AttributeDefinition",
      "isAbstract": false,
      "summary": "An AttributeDefinition is a Definition and a DataType of information about a quality or characteristic of a system or part of a system that has no independent i…",
      "extends": [
        "DataType",
        "Definition"
      ],
      "file": "elements/AttributeDefinition.md"
    },
    "AttributeUsage": {
      "kind": "class",
      "package": "Attributes",
      "qualifiedName": "SysML::Systems::Attributes::AttributeUsage",
      "isAbstract": false,
      "summary": "An AttributeUsage is a Usage whose type is a DataType.",
      "extends": [
        "Usage"
      ],
      "file": "elements/AttributeUsage.md"
    },
    "Behavior": {
      "kind": "class",
      "package": "Behaviors",
      "qualifiedName": "KerML::Kernel::Behaviors::Behavior",
      "isAbstract": false,
      "summary": "A Behavior coordinates occurrences of other Behaviors, as well as changes in objects.",
      "extends": [
        "Class"
      ],
      "file": "elements/Behavior.md"
    },
    "BindingConnector": {
      "kind": "class",
      "package": "Connectors",
      "qualifiedName": "KerML::Kernel::Connectors::BindingConnector",
      "isAbstract": false,
      "summary": "A BindingConnector is a binary Connector that requires its relatedFeatures to identify the same things (have the same values).",
      "extends": [
        "Connector"
      ],
      "file": "elements/BindingConnector.md"
    },
    "BindingConnectorAsUsage": {
      "kind": "class",
      "package": "Connections",
      "qualifiedName": "SysML::Systems::Connections::BindingConnectorAsUsage",
      "isAbstract": false,
      "summary": "A BindingConnectorAsUsage is both a BindingConnector and a ConnectorAsUsage.",
      "extends": [
        "BindingConnector",
        "ConnectorAsUsage"
      ],
      "file": "elements/BindingConnectorAsUsage.md"
    },
    "Boolean": {
      "kind": "primitiveType",
      "package": "PrimitiveTypes",
      "qualifiedName": "PrimitiveTypes::Boolean",
      "isAbstract": false,
      "summary": "Boolean is used for logical expressions, consisting of the predefined values true and false.",
      "extends": [],
      "file": "elements/Boolean.md"
    },
    "BooleanExpression": {
      "kind": "class",
      "package": "Functions",
      "qualifiedName": "KerML::Kernel::Functions::BooleanExpression",
      "isAbstract": false,
      "summary": "A BooleanExpression is a Boolean-valued Expression whose type is a Predicate.",
      "extends": [
        "Expression"
      ],
      "file": "elements/BooleanExpression.md"
    },
    "CalculationDefinition": {
      "kind": "class",
      "package": "Calculations",
      "qualifiedName": "SysML::Systems::Calculations::CalculationDefinition",
      "isAbstract": false,
      "summary": "A CalculationDefinition is an <coed>ActionDefinition that also defines a Function producing a result.</coed>",
      "extends": [
        "ActionDefinition",
        "Function"
      ],
      "file": "elements/CalculationDefinition.md"
    },
    "CalculationUsage": {
      "kind": "class",
      "package": "Calculations",
      "qualifiedName": "SysML::Systems::Calculations::CalculationUsage",
      "isAbstract": false,
      "summary": "A CalculationUsage is an ActionUsage that is also an Expression, and, so, is typed by a Function.",
      "extends": [
        "ActionUsage",
        "Expression"
      ],
      "file": "elements/CalculationUsage.md"
    },
    "CaseDefinition": {
      "kind": "class",
      "package": "Cases",
      "qualifiedName": "SysML::Systems::Cases::CaseDefinition",